{
  "asset_id": "single-bess-1",
  "type": "day_ahead",
  "market_bid_area": "DE-LU",
  "version": 1,
  "windows": [
    { "start": "2026-03-28T22:00:00Z", "end": "2026-03-28T23:00:00Z", "target_power_kw": 0 },
    { "start": "2026-03-28T23:00:00Z", "end": "2026-03-29T00:00:00Z", "target_power_kw": 0 },
    { "start": "2026-03-29T00:00:00Z", "end": "2026-03-29T01:00:00Z", "target_power_kw": 10 },
    { "start": "2026-03-29T01:00:00Z", "end": "2026-03-29T02:00:00Z", "target_power_kw": 20 },
    { "start": "2026-03-29T02:00:00Z", "end": "2026-03-29T03:00:00Z", "target_power_kw": -15 },
    { "start": "2026-03-29T03:00:00Z", "end": "2026-03-29T04:00:00Z", "target_power_kw": -25 }
  ]
}
